{
  "schema_version": "noctty.verification.baseline-manifest.v1",
  "captured_at": "2026-09-03T03:34:28.0175349Z",
  "git_commit": "34850eb9b191e0c350918f6311568d9348f534eb",
  "platform": {
    "os": "Windows 11",
    "architecture": "x86_64",
    "description": "Post-rebrand Windows-checkout source contracts, rolled forward for FULLSCREEN-SESSION-01 after the issue #123 paste-path, issue #131 scrollback-content, issue #133 named-layout and PKG-44 forward-compatibility reviews. Schema v1 adds the fullscreen state and optional fullscreen_maximized return flag; older tolerant readers restore unknown states as normal and skip unknown fields. The parser retains strict node kinds and axes, .allocate = .alloc_always ownership, opaque-JSON named-layout placement stripping, bounded scrollback and load-time pane-text rejection (InvalidPaneText). Hashes reflect checkout normalization. The durable git_commit identifies the original baseline base; Contracts.99-Baselines.ps1 independently pins the reviewed session-schema digest so squash-merging and deleting the PR branch cannot disable fail-closed artifact verification."
  },
  "artifacts": [
    {
      "id": "session-schema-v1",
      "kind": "session",
      "path": "src/apprt/win32_session_state.zig",
      "sha256": "de66d7d1c3859a56540d4dc8b67080befc1a52a46e53baafc07e7a84699fd11d",
      "scenario_id": null
    },
    {
      "id": "portable-cli-harness",
      "kind": "contract",
      "path": "test/windows/package-portable-cli.ps1",
      "sha256": "e835bc487ce36413b95dd1eaea79b96b98a125547e3fc1297dce298d55448ff4",
      "scenario_id": "windows.portable-cli.x64"
    }
  ]
}
